{
 "schema_version": "1.0",
 "garment": "aldrich_skirt",
 "units": "m",
 "convention": "world: metres, y up, +z front, +x the wearer's left (the alignment result's frame); uv: the piece bundle's outline_m frame (the <piece>_m.obj frame); lengths *_cm are flat (true) piece lengths",
 "inputs": {
  "stitching": "assert/stitchings/aldrich_skirt.stitching.json",
  "stitching_sha256": "ea2ab69a2e084df6aa551b7d24e3c96f1d40a484cb9084dc03eccc989713aec8",
  "assembly": "assert/assemblies/aldrich_skirt.assembly.json",
  "assembly_sha256": "2f2b5ea484d048abe6c0a1b0f61e51ce9675bb0d2c8286841c25acc6b17b85c3",
  "run": "build/_stitch_runs/aldrich_skirt-syn-b7de14631ba59227",
  "alignment_result_sha256": "d8f1d5816c1c7f8666a942147f62158f7bfc2427b8d472452bffce2b9ac9c6e6",
  "synthetic": true
 },
 "defaults": {
  "samples_per_cm": 2,
  "max_length_diff_pct": 3,
  "max_gap_m": 0.3
 },
 "seams": [
  {
   "id": "front_dart_R",
   "label": "right front dart: leg A17a -> apex A18 to leg A17b -> A18",
   "kind": "dart",
   "required": true,
   "allow_far": false,
   "a": {
    "piece": "A - Skirt Front",
    "edge_ids": [],
    "polyline_m": [
     [
      -0.14992,
      1.209039,
      0.164855
     ],
     [
      -0.149757,
      1.204017,
      0.164996
     ],
     [
      -0.149599,
      1.198994,
      0.165143
     ],
     [
      -0.149438,
      1.193972,
      0.165287
     ],
     [
      -0.149277,
      1.188949,
      0.165429
     ],
     [
      -0.149118,
      1.183927,
      0.165575
     ],
     [
      -0.148959,
      1.178904,
      0.165721
     ],
     [
      -0.1488,
      1.173882,
      0.165866
     ],
     [
      -0.148638,
      1.16886,
      0.166008
     ],
     [
      -0.148476,
      1.163837,
      0.166151
     ],
     [
      -0.148315,
      1.158815,
      0.166294
     ],
     [
      -0.148156,
      1.153792,
      0.166439
     ],
     [
      -0.147993,
      1.14877,
      0.166581
     ],
     [
      -0.147831,
      1.143748,
      0.166723
     ],
     [
      -0.147671,
      1.138725,
      0.166867
     ],
     [
      -0.147511,
      1.133703,
      0.167012
     ],
     [
      -0.14735,
      1.12868,
      0.167154
     ],
     [
      -0.147187,
      1.123658,
      0.167296
     ],
     [
      -0.147024,
      1.118636,
      0.167437
     ],
     [
      -0.146863,
      1.113613,
      0.16758
     ],
     [
      -0.146701,
      1.108591,
      0.167722
     ],
     [
      -0.146537,
      1.103568,
      0.167862
     ],
     [
      -0.146375,
      1.098546,
      0.168004
     ],
     [
      -0.146213,
      1.093523,
      0.168147
     ],
     [
      -0.146052,
      1.088501,
      0.168289
     ]
    ],
    "parts": [
     {
      "piece": "A - Skirt Front",
      "chain": [
       "A17a",
       "A18"
      ],
      "direction": "line",
      "trim_m": [
       0.0,
       0.0
      ],
      "edge_ids": [],
      "length_cm": 12.0649,
      "world_length_cm": 12.0649,
      "polyline_m": [
       [
        -0.14992,
        1.209039,
        0.164855
       ],
       [
        -0.149757,
        1.204017,
        0.164996
       ],
       [
        -0.149599,
        1.198994,
        0.165143
       ],
       [
        -0.149438,
        1.193972,
        0.165287
       ],
       [
        -0.149277,
        1.188949,
        0.165429
       ],
       [
        -0.149118,
        1.183927,
        0.165575
       ],
       [
        -0.148959,
        1.178904,
        0.165721
       ],
       [
        -0.1488,
        1.173882,
        0.165866
       ],
       [
        -0.148638,
        1.16886,
        0.166008
       ],
       [
        -0.148476,
        1.163837,
        0.166151
       ],
       [
        -0.148315,
        1.158815,
        0.166294
       ],
       [
        -0.148156,
        1.153792,
        0.166439
       ],
       [
        -0.147993,
        1.14877,
        0.166581
       ],
       [
        -0.147831,
        1.143748,
        0.166723
       ],
       [
        -0.147671,
        1.138725,
        0.166867
       ],
       [
        -0.147511,
        1.133703,
        0.167012
       ],
       [
        -0.14735,
        1.12868,
        0.167154
       ],
       [
        -0.147187,
        1.123658,
        0.167296
       ],
       [
        -0.147024,
        1.118636,
        0.167437
       ],
       [
        -0.146863,
        1.113613,
        0.16758
       ],
       [
        -0.146701,
        1.108591,
        0.167722
       ],
       [
        -0.146537,
        1.103568,
        0.167862
       ],
       [
        -0.146375,
        1.098546,
        0.168004
       ],
       [
        -0.146213,
        1.093523,
        0.168147
       ],
       [
        -0.146052,
        1.088501,
        0.168289
       ]
      ]
     }
    ]
   },
   "b": {
    "piece": "A - Skirt Front",
    "edge_ids": [],
    "polyline_m": [
     [
      -0.130558,
      1.207518,
      0.180576
     ],
     [
      -0.131222,
      1.202559,
      0.18009
     ],
     [
      -0.131886,
      1.1976,
      0.179603
     ],
     [
      -0.132551,
      1.192641,
      0.179116
     ],
     [
      -0.133211,
      1.187682,
      0.178624
     ],
     [
      -0.133872,
      1.182723,
      0.178132
     ],
     [
      -0.13453,
      1.177764,
      0.177635
     ],
     [
      -0.135187,
      1.172804,
      0.177135
     ],
     [
      -0.135841,
      1.167845,
      0.176633
     ],
     [
      -0.136493,
      1.162886,
      0.176129
     ],
     [
      -0.137146,
      1.157928,
      0.175624
     ],
     [
      -0.137792,
      1.152968,
      0.175112
     ],
     [
      -0.13844,
      1.148009,
      0.174603
     ],
     [
      -0.139084,
      1.143051,
      0.174087
     ],
     [
      -0.139727,
      1.138091,
      0.173572
     ],
     [
      -0.140371,
      1.133133,
      0.173055
     ],
     [
      -0.141007,
      1.128174,
      0.172532
     ],
     [
      -0.141646,
      1.123214,
      0.172012
     ],
     [
      -0.142281,
      1.118256,
      0.171485
     ],
     [
      -0.142914,
      1.113296,
      0.170957
     ],
     [
      -0.143547,
      1.108337,
      0.170429
     ],
     [
      -0.144175,
      1.103378,
      0.169896
     ],
     [
      -0.144805,
      1.098419,
      0.169365
     ],
     [
      -0.145428,
      1.09346,
      0.168827
     ],
     [
      -0.146052,
      1.088501,
      0.168289
     ]
    ],
    "parts": [
     {
      "piece": "A - Skirt Front",
      "chain": [
       "A17b",
       "A18"
      ],
      "direction": "line",
      "trim_m": [
       0.0,
       0.0
      ],
      "edge_ids": [],
      "length_cm": 12.0649,
      "world_length_cm": 12.065,
      "polyline_m": [
       [
        -0.130558,
        1.207518,
        0.180576
       ],
       [
        -0.131222,
        1.202559,
        0.18009
       ],
       [
        -0.131886,
        1.1976,
        0.179603
       ],
       [
        -0.132551,
        1.192641,
        0.179116
       ],
       [
        -0.133211,
        1.187682,
        0.178624
       ],
       [
        -0.133872,
        1.182723,
        0.178132
       ],
       [
        -0.13453,
        1.177764,
        0.177635
       ],
       [
        -0.135187,
        1.172804,
        0.177135
       ],
       [
        -0.135841,
        1.167845,
        0.176633
       ],
       [
        -0.136493,
        1.162886,
        0.176129
       ],
       [
        -0.137146,
        1.157928,
        0.175624
       ],
       [
        -0.137792,
        1.152968,
        0.175112
       ],
       [
        -0.13844,
        1.148009,
        0.174603
       ],
       [
        -0.139084,
        1.143051,
        0.174087
       ],
       [
        -0.139727,
        1.138091,
        0.173572
       ],
       [
        -0.140371,
        1.133133,
        0.173055
       ],
       [
        -0.141007,
        1.128174,
        0.172532
       ],
       [
        -0.141646,
        1.123214,
        0.172012
       ],
       [
        -0.142281,
        1.118256,
        0.171485
       ],
       [
        -0.142914,
        1.113296,
        0.170957
       ],
       [
        -0.143547,
        1.108337,
        0.170429
       ],
       [
        -0.144175,
        1.103378,
        0.169896
       ],
       [
        -0.144805,
        1.098419,
        0.169365
       ],
       [
        -0.145428,
        1.09346,
        0.168827
       ],
       [
        -0.146052,
        1.088501,
        0.168289
       ]
      ]
     }
    ]
   },
   "length_a_cm": 12.0649,
   "length_b_cm": 12.0649,
   "world_length_a_cm": 12.0649,
   "world_length_b_cm": 12.065,
   "ratio": 1.0,
   "ease": {
    "mode": "none",
    "declared_ratio": 1.0,
    "tolerance_pct": 3.0,
    "applied_ratio": 1.0,
    "gathered_side": "b",
    "excess_cm": 0.0
   },
   "samples": {
    "count": 26,
    "s": [
     0.0,
     0.04,
     0.08,
     0.12,
     0.16,
     0.2,
     0.24,
     0.28,
     0.32,
     0.36,
     0.4,
     0.44,
     0.48,
     0.52,
     0.56,
     0.6,
     0.64,
     0.68,
     0.72,
     0.76,
     0.8,
     0.84,
     0.88,
     0.92,
     0.96,
     1.0
    ],
    "a_xyz_m": [
     [
      -0.14992,
      1.209039,
      0.164855
     ],
     [
      -0.149764,
      1.204217,
      0.164991
     ],
     [
      -0.149612,
      1.199396,
      0.165132
     ],
     [
      -0.149457,
      1.194574,
      0.165268
     ],
     [
      -0.149304,
      1.189753,
      0.165408
     ],
     [
      -0.149152,
      1.184931,
      0.165548
     ],
     [
      -0.148999,
      1.18011,
      0.165687
     ],
     [
      -0.148843,
      1.175288,
      0.165823
     ],
     [
      -0.148687,
      1.170467,
      0.16596
     ],
     [
      -0.148534,
      1.165645,
      0.166099
     ],
     [
      -0.148381,
      1.160824,
      0.166238
     ],
     [